company_name,company_name_full,link_report,report_year,activity,Sub_activity_code,main_activity_code,main_activity_label,environmental_objective,pages_by_KPI,industry,country,sector,company,activity_raw,activity_clean,sub_activity_code,bench_objective,match_key,bench_idx
ringmetall se na,RINGMETALL SE  NA O.N.,,2023,transport by motorbikes passenger cars and light commercial vehicles,6.5,6,transport,CCM,,packaging,germany,industrials,RINGMETALL SE  NA O.N.,transport by motorbikes passenger cars and light commercial vehicles,transport by motorbikes passenger cars and light commercial vehicles,6.5,CCM,RINGMETALL SE  NA O.N.||transport by motorbikes passenger cars and light commercial vehicles,1199
rwe,RWE AG St,,2023,transmission and distribution of electricity,4.9,4,energy,CCM,,mining energy industry,germany,energy,RWE AG St,transmission and distribution of electricity,transmission and distribution of electricity,4.9,CCM,RWE AG St||transmission and distribution of electricity,1212
salzgitter,Salzgitter AG,,2023,freight rail transport,6.2,6,transport,CCM,,steel industry,germany,materials,Salzgitter AG,freight rail transport,freight rail transport,6.2,CCM,Salzgitter AG||freight rail transport,1217
suss microtec,SUSS MicroTec SE,,2023,manufacture of other low carbon technologies,3.6,3,manufacturing,CCM,,semiconductor industry,germany,information technology,SUSS MicroTec SE,manufacture of other low carbon technologies,manufacture of other low carbon technologies,3.6,CCM,SUSS MicroTec SE||manufacture of other low carbon technologies,1307
talanx,Talanx Aktiengesellschaft,,2023,electricity generation from wind power,4.3,4,energy,CCM,,insurance financial,germany,financials,Talanx Aktiengesellschaft,electricity generation from wind power,electricity generation from wind power,4.3,CCM,Talanx Aktiengesellschaft||electricity generation from wind power,1323
talanx,Talanx Aktiengesellschaft,,2023,electricity generation using solar photovoltaic technology,4.1,4,energy,CCM,,insurance financial,germany,financials,Talanx Aktiengesellschaft,electricity generation using solar photovoltaic technology,electricity generation using solar photovoltaic technology,4.1,CCM,Talanx Aktiengesellschaft||electricity generation using solar photovoltaic technology,1324
talanx,Talanx Aktiengesellschaft,,2023,non life insurance underwriting of climate related perils,10.1,10,financial insurance activities,CE,,insurance financial,germany,financials,Talanx Aktiengesellschaft,non life insurance underwriting of climate related perils,non life insurance underwriting of climate related perils,10.1,CE,Talanx Aktiengesellschaft||non life insurance underwriting of climate related perils,1325
talanx,Talanx Aktiengesellschaft,,2023,acquisition and ownership of buildings,7.7,7,construction real estate activities,CCM,,insurance financial,germany,financials,Talanx Aktiengesellschaft,acquisition and ownership of buildings,acquisition and ownership of buildings,7.7,CCM,Talanx Aktiengesellschaft||acquisition and ownership of buildings,1326
technotrans,technotrans SE,,2023,electricity generation using solar photovoltaic technology,4.1,4,energy,CCM,,thermomanagement,germany,industrials,technotrans SE,electricity generation using solar photovoltaic technology,electricity generation using solar photovoltaic technology,4.1,CCM,technotrans SE||electricity generation using solar photovoltaic technology,1342
uniqa insurance,UNIQA Insurance Group AG,,2023,non life insurance underwriting of climate related perils,10.1,10,financial insurance activities,CE,,insurance,austria,financials,UNIQA Insurance Group AG,non life insurance underwriting of climate related perils,non life insurance underwriting of climate related perils,10.1,CE,UNIQA Insurance Group AG||non life insurance underwriting of climate related perils,1361
warimpex finanz und bet,Warimpex Finanz- und Bet. AG,,2023,construction of new buildings,7.1 /7.1 /3.1,7,construction real estate activities,CCM,,real estate,austria,real estate,Warimpex Finanz- und Bet. AG,construction of new buildings,construction of new buildings,7.1 /7.1 /3.1,CCM,Warimpex Finanz- und Bet. AG||construction of new buildings,1418
wienerberger,Wienerberger AG,,2023,electricity generation using solar photovoltaic technology,4.1,4,energy,CCM,,construction materials,austria,materials,Wienerberger AG,electricity generation using solar photovoltaic technology,electricity generation using solar photovoltaic technology,4.1,CCM,Wienerberger AG||electricity generation using solar photovoltaic technology,1430
wienerberger,Wienerberger AG,,2023,manufacture of equipment for the production and use of hydrogen,3.2,3,manufacturing,CCM,,construction materials,austria,materials,Wienerberger AG,manufacture of equipment for the production and use of hydrogen,manufacture of equipment for the production and use of hydrogen,3.2,CCM,Wienerberger AG||manufacture of equipment for the production and use of hydrogen,1431
wienerberger,Wienerberger AG,,2023,construction of new buildings,7.1 /7.1 /3.1,7,construction real estate activities,CCM,,construction materials,austria,materials,Wienerberger AG,construction of new buildings,construction of new buildings,7.1 /7.1 /3.1,CCM,Wienerberger AG||construction of new buildings,1432
wienerberger,Wienerberger AG,,2023,renovation of existing buildings,7.2,7,construction real estate activities,CCM,,construction materials,austria,materials,Wienerberger AG,renovation of existing buildings,renovation of existing buildings,7.2,CCM,Wienerberger AG||renovation of existing buildings,1433
wustenrot wurttembergische,Wüstenrot & Württembergische AG,,2023,construction of new buildings,7.1 /7.1 /3.1,7,construction real estate activities,CCM,,insurance financial,germany,financials,Wüstenrot & Württembergische AG,construction of new buildings,construction of new buildings,7.1 /7.1 /3.1,CCM,Wüstenrot & Württembergische AG||construction of new buildings,1437
wustenrot wurttembergische,Wüstenrot & Württembergische AG,,2023,electricity generation using solar photovoltaic technology,4.1,4,energy,CCM,,insurance financial,germany,financials,Wüstenrot & Württembergische AG,electricity generation using solar photovoltaic technology,electricity generation using solar photovoltaic technology,4.1,CCM,Wüstenrot & Württembergische AG||electricity generation using solar photovoltaic technology,1438
wustenrot wurttembergische,Wüstenrot & Württembergische AG,,2023,electricity generation from wind power,4.3,4,energy,CCM,,insurance financial,germany,financials,Wüstenrot & Württembergische AG,electricity generation from wind power,electricity generation from wind power,4.3,CCM,Wüstenrot & Württembergische AG||electricity generation from wind power,1439
zalando,Zalando SE,,2023,leasing of aircraft,6.18,6,transport,CCM,,online retail fashion retail,germany,consumer discretionary,Zalando SE,leasing of aircraft,leasing of aircraft,6.18,CCM,Zalando SE||leasing of aircraft,1441
industria de diseno textil,"Industria de Diseño Textil, S.A.",,2023,Preparation for re-use of end-of-life products and product components,5.3,5,"Water supply, sewerage, waste management and remediation",CE,,"Fashion, Retail",Spain,Consumer Discretionary,"Industria de Diseño Textil, S.A.",Preparation for re-use of end-of-life products and product components,preparation for re use of end of life products and product components,5.3,CE,"Industria de Diseño Textil, S.A.||preparation for re use of end of life products and product components",1476
industria de diseno textil,"Industria de Diseño Textil, S.A.",,2023,Sale of second-hand goods,5.4,5,"Water supply, sewerage, waste management and remediation",CE,,"Fashion, Retail",Spain,Consumer Discretionary,"Industria de Diseño Textil, S.A.",Sale of second-hand goods,sale of second hand goods,5.4,CE,"Industria de Diseño Textil, S.A.||sale of second hand goods",1477
industria de diseno textil,"Industria de Diseño Textil, S.A.",,2023,"Data processing, hosting and related activities",8.1,8,Information and communication,CCM,,"Fashion, Retail",Spain,Consumer Discretionary,"Industria de Diseño Textil, S.A.","Data processing, hosting and related activities",data processing hosting and related activities,8.1,CCM,"Industria de Diseño Textil, S.A.||data processing hosting and related activities",1478
industria de diseno textil,"Industria de Diseño Textil, S.A.",,2023,"Installation, maintenance and repair of instruments and devices for measuring, regulation and controlling energy performance of buildings",7.5 /7.5,7,Construction and real estate activities,CCM/CCA,,"Fashion, Retail",Spain,Consumer Discretionary,"Industria de Diseño Textil, S.A.","Installation, maintenance and repair of instruments and devices for measuring, regulation and controlling energy performance of buildings",installation maintenance and repair of instruments and devices for measuring regulation and controlling energy performance of buildings,7.5 /7.5,CCM/CCA,"Industria de Diseño Textil, S.A.||installation maintenance and repair of instruments and devices for measuring regulation and controlling energy performance of buildings",1480
industria de diseno textil,"Industria de Diseño Textil, S.A.",,2023,"Installation, maintenance and repair of renewable energy technologies",7.6,7,Construction and real estate activities,CMM,,"Fashion, Retail",Spain,Consumer Discretionary,"Industria de Diseño Textil, S.A.","Installation, maintenance and repair of renewable energy technologies",installation maintenance and repair of renewable energy technologies,7.6,CMM,"Industria de Diseño Textil, S.A.||installation maintenance and repair of renewable energy technologies",1481
